b'EBIT Margin of Leading IT Companies in #Q3FY22 #TCS 24.5% #Infosys 21.5% #HCLTech 19.58% #Wipro 15.6% https://t.co/wJdWa9MA2G',b'EBIT Margin of Leading IT Companies in #Q3FY22 #TCS 24.5% #Infosys 21.5% #HCL Tech 19.58% #Wipro 15.6% https://t.co/wedIA6F2cU',b'RT The hypocrisy when your wife\xe2\x80\x99s family business apparently still trades in Russia and as a family you benefit f\xe2\x80\xa6',b'RT E invoice portal is not working since 2PM why..?? _GSTN _Council #einvoice https://t.co/o6pKsmWR2E',b'RT E Invoice Portal Error Message at the time of Login _GSTN _india https://t.co/lMEpUlTbpH'
b'EBIT Margin of Leading IT Companies in #Q3FY22 #TCS 24.5% #Infosys 21.5% #HCLTech 19.58% #Wipro 15.6% https://t.co/wJdWa9MA2G',b'RT The hypocrisy when your wife\xe2\x80\x99s family business apparently still trades in Russia and as a family you benefit f\xe2\x80\xa6',b'RT E invoice portal is not working since 2PM why..?? _GSTN _Council #einvoice https://t.co/o6pKsmWR2E',b'RT E Invoice Portal Error Message at the time of Login _GSTN _india https://t.co/lMEpUlTbpH',"b""_Council _GSTN ewaybill site is not working as we are trying to generate ewaybill from past 2 hours but the site isn't loading"""
b'_GSTN System running slow pls take necessary action _Council',b'RT The hypocrisy when your wife\xe2\x80\x99s family business apparently still trades in Russia and as a family you benefit f\xe2\x80\xa6',b'RT #Infosys co-founder #NRNarayanaMurthy warned against #moonlighting and said that India needs a culture of honesty where ther\xe2\x80\xa6',b'_GSTN einv service unavailable pls resolve urgently',b'RT Seems like _GSTN e-invoice application server is down at mass level Not able to generate e-invoices for last 1 hou\xe2\x80\xa6'
b'_GSTN System running slow pls take necessary action _Council',b'RT The hypocrisy when your wife\xe2\x80\x99s family business apparently still trades in Russia and as a family you benefit f\xe2\x80\xa6',b'RT #Infosys co-founder #NRNarayanaMurthy warned against #moonlighting and said that India needs a culture of honesty where ther\xe2\x80\xa6',b'_GSTN einv service unavailable pls resolve urgently',b'RT Seems like _GSTN e-invoice application server is down at mass level Not able to generate e-invoices for last 1 hou\xe2\x80\xa6'
b'_GSTN kindly approve new registration ARN AA3302230795195 https://t.co/xNJEqjDnnH',b'Infosys cofounder saying take action no favourtism #adani case.',"b""Micromanagement Work from office only. Can't moonlighting No side gigs for extra income. Lala Company mentality https://t.co/GiP7N5ejkN""",b'But you also stand with #Russia done you Rishi! Your wife and her family still operating https://t.co/ywfvEr6ZpS',b'_GSTN System running slow pls take necessary action _Council'
b'_werwitch _india _GSTN Seriously they need to train officers before delegating work to them',b'RT _Foundation If you have an innovation that can help people \xf0\x9f\xa7\x91\xe2\x80\x8d\xf0\x9f\xa4\x9d\xe2\x80\x8d live better #AarohanAwards2023 can help you scale-up Visit http\xe2\x80\xa6',b'RT DIN generated &amp quoted by GST officers is appears to be a big SCAM DIN verification only validate whether DIN is valid\xe2\x80\xa6',b'RT \xe2\x80\x98Don\xe2\x80\x99t fall into this trap\xe2\x80\xa6\xe2\x80\x99 #Infosys founder #NarayanaMurthy warns young people https://t.co/VhqQsFeK7Z',"b""RT Micromanagement Work from office only. Can't moonlighting No side gigs for extra income. Lala Company mentality. Peanuts\xe2\x80\xa6"""
b'RT _748 We want Justice For innocent Sushant And Disha.\xf0\x9f\x99\x8fBecause #Justice4SSR Matters To Us. Millions are waiting..Silence of A\xe2\x80\xa6',b'https://t.co/PKhwQKdXJr',b'RT Thank you Shillong You are spectacular https://t.co/D82wNoyA2X',b'RT PM Shri holds roadshow in Shillong Meghalaya https://t.co/WKE5xyEtz4',b'RT Truth be told Punjab needs _Dhillon Send him in and clean up the mess You can\xe2\x80\x99t have an Amritpal jerk ruin Amrit K\xe2\x80\xa6',b'RT PM Shri Ji addresses public meeting in Dimapur Nagaland',b'Immediately https://t.co/f5rEwBM9D8',b'Good evening _gadkari _gadkari https://t.co/0bmNvMhEs4',b'RT Truth be told Punjab needs _Dhillon Send him in and clean up the mess You can\xe2\x80\x99t have an Amritpal jerk ruin Amrit K\xe2\x80\xa6',"b""RT Festive atmosphere in support of BJP in Meghalaya during Hon'ble PM Shri Ji's rally in Tura. #MeghalayaMan\xe2\x80\xa6""",b'RT Respected Please urgently repeal All the Laws made before 1950 Places of Worship Act 1991 Minority Commi\xe2\x80\xa6',b'RT _P A farmer in Maharashtra sold 5 quintals of potatoes in mandi &amp managed to earn Rs 2 only. Abuse discredit &amp vilify f\xe2\x80\xa6',b'Hate is like in blood Nourished with free money called reservation Will die on https://t.co/vBShdj0Lfc',b'RT Thank you Nagaland Will always cherish the affection https://t.co/y3j0Evb4oz',b'RT _k Hon PM Thiru avl is transforming the defence sector in our country My PM My Pride https://t.co/d3hYDNbG\xe2\x80\xa6',b'WATCH This Pakistan man wants PM Modi to fix his country #Pakistan #Pakistancrisis #nationnext #PMModi https://t.co/9zJ7oacupr',b'RT _k On behalf of congratulations to Hon Minister Thiru avl for winning the Business reformer\xe2\x80\xa6',b'#PMInNagaland 10 years ago no one would have ever dreamt that the circumstances can change in the northeast Howeve https://t.co/mAV4svshQH',b'What a gentleman what an orator has definitely set a tough benchmark for future Prime Ministers https://t.co/ozJ3xjYzjH',b'RT A youngster from Pakistan seems to understand the importance of our PM ji while many pseudo youngsters from\xe2\x80\xa6',b'RT Every time Hon PM Shri ji visits NE the spirit of our party and alliance partners gets a huge boost. Alon\xe2\x80\xa6',b'RT LOL Is this man elected as Prime Minister of India by Indians or Prime Minister of World by M\xe2\x80\xa6',b'RT _y Don\xe2\x80\x99t miss this epic reply of PM Ji https://t.co/BwfAVpqQ0P',b'We Are Followers Of Dasam Pita Guru Gobind Singh Ji .. And These Khalistani Heera Mandi Waale Are Followers Of Th https://t.co/jruBr2A6Mg',b'RT This sentence manifests the intention and commitment of our new _ladakh Brig (Dr. B.D Mishra Ji (Retd to serve the peo\xe2\x80\xa6',b'#PMInNagaland Northeast was only used as an ATM by Congress They used to withdraw money from this region and took https://t.co/9B0ucQF5Ct',b'\xf0\x9f\x87\xae should seriously consider having a j https://t.co/4LNroDpd9m',b'RT _k Hon PM Thiru avl is transforming the defence sector in our country My PM My Pride https://t.co/d3hYDNbG\xe2\x80\xa6',b'RT PM Shri ji addresses public meeting in Shillong Meghalaya. https://t.co/nOW9PU8tN7',"b""RT The #PMKisan Yojana has led to transformative changes in the lives of small farmers. PM 's vision to su\xe2\x80\xa6""",b'RT Every time Hon PM Shri ji visits NE the spirit of our party and alliance partners gets a huge boost. Alon\xe2\x80\xa6',b'RT Corruption was a major issue that plagued the Northeast\xe2\x80\x99s development Now resources are being utilised effectively for\xe2\x80\xa6',b'RT For Nagaland we have a mantra of Peace Progress and Prosperity PM Shri ji https://t.co/UNHdlGftFO',b'Jai Ho Respected PM Shri Narendra Modi Ji and Your Strong Team \xf0\x9f\x91\x8d\xf0\x9f\x92\x90\xf0\x9f\x92\xaf Jai Ho Vijay Ho Nagal https://t.co/WgGny1f9pV',"b""RT Youths of Vivekananda vichar Manch under Gomati district.They are very excited to receiving our pride our Hon'ble Form\xe2\x80\xa6""",b'RT LOL Is this man elected as Prime Minister of India by Indians or Prime Minister of World by M\xe2\x80\xa6',b'#PMInNagaland For Nagaland our mantra is Peace Progress and Prosperity \xe2\x81\xa6 \xe2\x81\xa6 \xe2\x81\xa6 https://t.co/uoG65UWnCB',b'RT PM Shri ji holds roadshow in Shillong Meghalaya. https://t.co/5fmzCwEcrm',b'RT For decades successive Congress governments ignored the Northeast BJP has brought an era of peace stability and develo\xe2\x80\xa6',b'RT \xe2\x80\xa6',b'RT _k Hon PM Thiru avl is transforming the defence sector in our country My PM My Pride https://t.co/d3hYDNbG\xe2\x80\xa6',b'RT Every time Hon PM Shri ji visits NE the spirit of our party and alliance partners gets a huge boost. Alon\xe2\x80\xa6',b'RT In last five years regime did cut areas in #Nagaland under controversial AFSPA provisions Now \xe2\x80\xa6',b'RT Corruption was a major issue that plagued the Northeast\xe2\x80\x99s development Now resources are being utilised effectively for\xe2\x80\xa6',b'#PMInNagaland During Congress Nagaland always had political instability Congress ran the Nagaland govt through a https://t.co/KXK9Ax2IWc',"b""RT \xf0\x9f\x93\x8cWhat happened at Jogger's park with Sushant\xe2\x9d\x93 _nupurprasad Nexus\xe2\x80\xa6""","b""RT PM Shri ji addresses post-budget webinar on 'Agriculture and Cooperatives'. https://t.co/Uhtqq5Vi2i""",b'RT We have focussed on furthering \xe2\x80\x98Ease of Living and \xe2\x80\x98Ease of Doing Business in Nagaland https://t.co/VZxrQEm0Ta',b'RT _Chandrani_ Day 985 Of Injustices to SUSHANT SINGH RAJPUT and Still Our Judiciary System Making Mockery of law and Justice \xe2\x9a\x96\xef\xb8\x8f \xe2\x80\xa6',b'Sir ji 100 right #MODI2024',b'RT From technology to sports to StartUps\xe2\x80\xa6we have been working diligently for Nagaland\xe2\x80\x99s progress https://t.co/dO7YmeUpKq',b'Prime Minister is a proud ambassador of Naga culture. https://t.co/drjPPVpOFQ',b'RT In our endeavour of serving Nagaland we have focussed on the poor and tribal sections of society https://t.co/dNCrbrJ2Cg',b'RT _k Hon PM Thiru avl is transforming the defence sector in our country My PM My Pride https://t.co/d3hYDNbG\xe2\x80\xa6',b'RT _k Hon PM Thiru avl is transforming the defence sector in our country My PM My Pride https://t.co/d3hYDNbG\xe2\x80\xa6',b'RT India\xe2\x80\x99s potential in green energy no less than a goldmine invest here PM https://t.co/aRA247rIV6 via NaMo A\xe2\x80\xa6',b'RT PM Shri ji addresses public meeting in Dimapur Nagaland. https://t.co/yvPowwFi6m',"b""RT I am blessed to be showered love by people in large numbers But this love and affection towards BJP aren't getting digest\xe2\x80\xa6""",b'RT _k Hon PM Thiru avl is transforming the defence sector in our country My PM My Pride https://t.co/d3hYDNbG\xe2\x80\xa6',b'RT _k Hon PM Thiru avl is transforming the defence sector in our country My PM My Pride https://t.co/d3hYDNbG\xe2\x80\xa6',b'RT I do not want a ground for connecting with the people of Tura because people here have accepted me in their heart The ges\xe2\x80\xa6',b'RT PM Shri Ji holds roadshow in Shillong Meghalaya https://t.co/AFOHETVPq0',b'RT Honorable prime minister ji It is very unfortunate that a govt which is so sensitive towards status of women i\xe2\x80\xa6',b'RT Thank you Shillong You are spectacular https://t.co/D82wNoyA2X',"b""RT ji When Indian government can release 7 German national -why can't we get 2 year old Ariha who is in custody o\xe2\x80\xa6""",b'RT Thank you Shillong You are spectacular https://t.co/D82wNoyA2X',b'RT Truth be told Punjab needs _Dhillon Send him in and clean up the mess You can\xe2\x80\x99t have an Amritpal jerk ruin Amrit K\xe2\x80\xa6',b'RT GERMANY RETURN ARIHA \xe2\x9c\x8a\xf0\x9f\x98\xa1 #BoycottGermany #GermanyReturnAriha #SaveAriha #JusticeForAriha #BharatKiBeti \xe2\x80\xa6',b'RT Examples like UPI can be templates for many other countries too We would be happy to share our experience with the world PM\xe2\x80\xa6',b'RT Hon Prime Minister Shri ji addressing public meeting in Dimapur Nagaland https://t.co/Y6tY792aPJ',b'RT _k On behalf of congratulations to Hon Minister Thiru avl for winning the Business reformer\xe2\x80\xa6',b'RT Thank you Nagaland Will always cherish the affection https://t.co/y3j0Evb4oz',"b""RT PM Shri ji's remarks at G20 Finance Ministers and Central Bank Governors Meeting. https://t.co/DAEwFk\xe2\x80\xa6""",b'RT Pic of the day https://t.co/PxRb3Z8o1I',b'RT _k Hon PM Thiru avl is transforming the defence sector in our country My PM My Pride https://t.co/d3hYDNbG\xe2\x80\xa6',b'RT From technology to sports to StartUps\xe2\x80\xa6we have been working diligently for Nagaland\xe2\x80\x99s progress https://t.co/dO7YmeUpKq',"b""RT I am confident in the love and blessings that '\xf0\x9d\x90\x8c\xf0\x9d\x90\x9e\xf0\x9d\x90\xa0\xf0\x9d\x90\xa1\xf0\x9d\x90\x9a\xf0\x9d\x90\xa5\xf0\x9d\x90\x9a\xf0\x9d\x90\xb2 \xf0\x9d\x90\x8c\xf0\x9d\x90\x9a\xf0\x9d\x90\x9a\xf0\x9d\x90\xa7\xf0\x9d\x90\xa0 \xf0\x9d\x90\x81\xf0\x9d\x90\x89 \xf0\x9d\x90\x92\xf0\x9d\x90\x9a\xf0\x9d\x90\xab\xf0\x9d\x90\xa4\xf0\x9d\x90\x9a\xf0\x9d\x90\xab' BJP govt for Meghalaya means fast pace deve\xe2\x80\xa6""",b'RT Honorable prime minister ji It is very unfortunate that a govt which is so sensitive towards status of\xe2\x80\xa6',b'RT In our endeavour of serving Nagaland we have focussed on the poor and tribal sections of society https://t.co/dNCrbrJ2Cg',b'RT _qadri #Padhega #Kashmir tabhi to Badhega #Kashmir.The talents in Kashmir are way beyond the ordinary #WomenInKashmir will alway\xe2\x80\xa6',b'This is really very important issue and police really need to take serious action https://t.co/6g9jApqQnP',b'RT We have focussed on furthering \xe2\x80\x98Ease of Living and \xe2\x80\x98Ease of Doing Business in Nagaland https://t.co/VZxrQEm0Ta',b'RT _k Hon PM Thiru avl is transforming the defence sector in our country My PM My Pride https://t.co/d3hYDNbG\xe2\x80\xa6',b'RT Thank you Nagaland Will always cherish the affection https://t.co/y3j0Evb4oz',b'RT People were only aware of Japanese Cherry blossoms but after I spoke about cherry blossoms from Meghalaya people understood\xe2\x80\xa6',b'RT Congress governments have always ignored these areas but BJP considers northeast as the growth engine of the country. PM\xe2\x80\xa6',b'#PMInNagaland \xe2\x80\x98Get vote and forget\xe2\x80\x99 This has been the policy of the Congress and its partners for Nagaland and th https://t.co/tIPdfsOP4F',b'RT Corruption was a major issue that plagued the Northeast\xe2\x80\x99s development Now resources are being utilised effectively for\xe2\x80\xa6',b'Everyone wants answers from the government that why these policemen are not arresting them.. https://t.co/oBFyxtwWTt',b'RT _k Hon PM Thiru avl is transforming the defence sector in our country My PM My Pride https://t.co/d3hYDNbG\xe2\x80\xa6',b'RT \xe2\x9d\xa3\xef\xb8\x8f \xe2\x9d\xa3\xef\xb8\x8f Nexus Sabotaging Sushant Case Plz. _Fadnavis \xf0\x9f\x91\x87 #JusticeF\xe2\x80\xa6',b'RT For decades successive Congress governments ignored the Northeast BJP has brought an era of peace stability and develo\xe2\x80\xa6',b'RT Truth be told Punjab needs _Dhillon Send him in and clean up the mess You can\xe2\x80\x99t have an Amritpal jerk ruin Amrit K\xe2\x80\xa6',b'RT Thank you Shillong You are spectacular https://t.co/D82wNoyA2X',b'RT Thank you Shillong You are spectacular https://t.co/D82wNoyA2X',b'RT Love from Nagaland. https://t.co/apVi8ttKRC',b'RT Under the BJP government neighbouring states of Meghalaya have achieved fast-paced development. PM https:/\xe2\x80\xa6',b'#PMInNagaland There is a wave of development and trust in Nagaland We have huge support for the BJP and NDPP in Na https://t.co/WRDS2XE20P',b'RT PM Shri holds roadshow in Shillong Meghalaya https://t.co/WKE5xyEtz4',b'Masterstroke syndrome instead of common sense'
b'RT The reason selfie becomes disaster before release National Panauti #SalmanKhan 1st destroyed Ayush sharma 2nd Chiranjeevi\xe2\x80\xa6',b'Actor #AkshayKumar has finally applied to get his Canadian passport changed. https://t.co/cVAvKffZnd',b'RT #Selfiee is a story of a tussle between a bollywood star and his fan with lead roles played by Akshay Kumar and Emraan Ha\xe2\x80\xa6',"b""RT #Selfiee starring #AkshayKumar is reasonably entertaining It's not as good as #DrivingLicence *ing #PrithvirajSukumaran,\xe2\x80\xa6""",b'RT #Selfiee is a story of a tussle between a bollywood star and his fan with lead roles played by Akshay Kumar and Emraan Ha\xe2\x80\xa6'
"b'RT Akshay Kumar and Emraan Hashmi Starrer ""Selfiee Gets Positive Response From Critics and Audiences #Selfiee #SelfieeRe\xe2\x80\xa6'","b""RT _Starr I don't get Akshay Kumar. He had admittedly taken Canadian citizenship after a string of flop films. And now he has decide\xe2\x80\xa6""",b'RT The reason selfie becomes disaster before release National Panauti #SalmanKhan 1st destroyed Ayush sharma 2nd Chiranjeevi\xe2\x80\xa6',b'Actor #AkshayKumar has finally applied to get his Canadian passport changed. https://t.co/cVAvKffZnd',b'RT #Selfiee is a story of a tussle between a bollywood star and his fan with lead roles played by Akshay Kumar and Emraan Ha\xe2\x80\xa6'
"b""RT _ Bollywood's two powerhouses Akshay Kumar and Emraan Hashmi sharing the screen in #SelfieeInCinemas is giving me goos\xe2\x80\xa6""",b'RT #SanjayDutt and #ArshadWarsi to join #AkshayKumar in #Welcome3. https://t.co/pu6hGI1H8v',b'RT Did you know?\xf0\x9f\xa4\x94 Akshay Kumar and Emraan Hashmi will be teaming up for the first time in the movie \xe2\x80\x98Selfiee\xe2\x80\x99 Experience it\xe2\x80\xa6',b'please ask makers to remove akshay kumar from #HeraPheri3 and replace h https://t.co/Dmeees9Njp',b'Chakki fans Agar Kabul Kare Akshay Kumar ka Baap ShahRukh Khan tabhi in pe Taras kha unga But They should 1st bent https://t.co/IHqkD7NfH3'
b'RT Be it youth women traders or government servants everyone is asking for a BJP government The sentiment in support of\xe2\x80\xa6',"b'RT Tigrayans were expelled from the military &amp the civil service,&amp 1000s withdrew into Tigray. The anti-Tigrayan sentiment was c\xe2\x80\xa6'"
"b""RT Tory hypocrisy NHS Clap for the nurses but don't pay them and break Covid Laws Ukraine Sunaks have \xc2\xa3700m in Mosc\xe2\x80\xa6""",b'Dear the issue is resolved Please retry.'
b'Dear we regret the inconvenience caused The issue is resolved Please retry.',"b""RT Tory hypocrisy NHS Clap for the nurses but don't pay them and break Covid Laws Ukraine Sunaks have \xc2\xa3700m in Mosc\xe2\x80\xa6""","b""RT Tory hypocrisy NHS Clap for the nurses but don't pay them and break Covid Laws Ukraine Sunaks have \xc2\xa3700m in Mosc\xe2\x80\xa6"""
"b""RT _Singh1 Mega Trend Alert Join With Us For This Revolution We Don't Let Farhad Samji To Ruin Our Cult Classic Emotion #HeraPher\xe2\x80\xa6""",b'RT _1God Selfiee is the weakest Opening for any Akshay kumar starrrer Yet Fans have the Guts to defend this figures all because o\xe2\x80\xa6',b'RT __ Dear Bollywood fans If u are supporting Akshay Kumar then please note that you are Directly Supporting the Boycott Gang\xe2\x80\xa6',b'RT __ Dear Bollywood fans If u are supporting Akshay Kumar then please note that you are Directly Supporting the Boycott Gang\xe2\x80\xa6'
"b""Akshay Kumar used his fake fan's during Aryan case shame on I am happy you are facing you karma disast https://t.co/sUd0Nb6eHX""",b'RT _1God Selfiee is the weakest Opening for any Akshay kumar starrrer Yet Fans have the Guts to defend this figures all because o\xe2\x80\xa6',"b""RT _ Bollywood's two powerhouses Akshay Kumar and Emraan Hashmi sharing the screen in #SelfieeInCinemas is giving me goos\xe2\x80\xa6""",b'. ji hosting Seedhi Baat and on the hot seat in the first episode what more to ask ? https://t.co/LylFFKC573'
b'There are many more good people in Bahariya Life than what Akshay Kumar appears on the screen. #AkshayOnSeedhiBaat https://t.co/lvznkvJ0Y5',b'Guys now make your weekend more enjoyable by watching this awesome episode to see our favourite bollywood actor Aks https://t.co/3hQoM7Vh6G',b'Akshay kumar is very emotional guys when sudhir ji said about mother #AkshayOnSeedhiBaat',b'With ji Seedhi Baat will be very interesting and in the first episode is the icing on https://t.co/YZCOrRjlJz'
"b""I think nobody can't miss to watch this amazing interview of our favourite actor Akshay Kumar in this amazing show https://t.co/ULLEcZJBha""",b'ji Seedhi Baat will be very interesting and in the first episode is the icing on the https://t.co/3RRmG8BDti',"b""Akshay Kumar's words can be very painful He had asked that he misses his mother a lot.#AkshayOnSeedhiBaat""","b""In a conversation with Sudhir Chaudhary Akshay Kumar's emotional side was revealed despite his image as an action https://t.co/zTd8qJQfzQ"""
b'RT Just yesterday I was surprised by how he not only kept downplaying but discouraging product in\xe2\x80\xa6',b'They don\xe2\x80\x99t His wife\xe2\x80\x99s company is still trading with Russia and and fri https://t.co/jINYfuGMEc',"b""RT For a couple who have more money than sense it's about time you employed people to dress you properly\xe2\x80\xa6""",b'_husain _india Dear _husain your request is being processed by the Jurisdictional Officer and will be a https://t.co/BJ8mrTiX5y',b'Yeah rite Young employee will pay the rent for the apartment owned by old and settled employee &amp apply personal lo https://t.co/Uvd10kNsen',b'will I be going live on LinkedIn at 11am to chat about Yes Yes I will....',b'RT _Foundation If you have an innovation that can help people \xf0\x9f\xa7\x91\xe2\x80\x8d\xf0\x9f\xa4\x9d\xe2\x80\x8d live better #AarohanAwards2023 can help you scale-up Visit http\xe2\x80\xa6',"b""RT Tory hypocrisy NHS Clap for the nurses but don't pay them and break Covid Laws Ukraine Sunaks have \xc2\xa3700m in Mosc\xe2\x80\xa6""",b'RT #GSTRegistration Revamped GST Registration Certificate for New Registrations!! \xe2\x9e\xa1\xef\xb8\x8fGST Watermark \xe2\x9e\xa1 Black Border \xe2\x9e\xa1\xef\xb8\x8fBl\xe2\x80\xa6',b'_shiv _india Dear _shiv it is working now Please retry.',b'_GSTN Can you share what details that \xe2\x80\x9cQR code contain If possible by scanning it !',"b""RT Tory hypocrisy NHS Clap for the nurses but don't pay them and break Covid Laws Ukraine Sunaks have \xc2\xa3700m in Mosc\xe2\x80\xa6""","b""RT Tory hypocrisy NHS Clap for the nurses but don't pay them and break Covid Laws Ukraine Sunaks have \xc2\xa3700m in Mosc\xe2\x80\xa6""",b'_GSTN _india Very thanks for taking quick action.',b'_Goyal _india Dear _Goyal the issue is resolved Please retry.',"b""RT Tory hypocrisy NHS Clap for the nurses but don't pay them and break Covid Laws Ukraine Sunaks have \xc2\xa3700m in Mosc\xe2\x80\xa6""",b'_MeitY _Council _GoI Dear we regret the inconv https://t.co/DBRmxhCG8G',"b""RT Tory hypocrisy NHS Clap for the nurses but don't pay them and break Covid Laws Ukraine Sunaks have \xc2\xa3700m in Mosc\xe2\x80\xa6""",b'_india Dear the issue is resolved Please retry.',b'_india Dear the issue is resolved Please retry.',b'Dear we regret the inconvenience caused The issue is resolved Please retry.',"b""RT Tory hypocrisy NHS Clap for the nurses but don't pay them and break Covid Laws Ukraine Sunaks have \xc2\xa3700m in Mosc\xe2\x80\xa6""","b""RT Tory hypocrisy NHS Clap for the nurses but don't pay them and break Covid Laws Ukraine Sunaks have \xc2\xa3700m in Mosc\xe2\x80\xa6""",b'Dear the issue is resolved Please retry.',b'No Activities Things will change',b'_GSTN _Council Till now the New Formula allowing ITC on Services has been updated on the https://t.co/0xiyOH0Ja2',"b""Tory hypocrisy NHS Clap for the nurses but don't pay them and break Covid Laws Ukraine Sunaks have \xc2\xa3700m in M https://t.co/2A1oX3iEfT""",b'_Council Dear we regret the inconvenienc https://t.co/zi7G4QzfwV',b'And where do Infosys stand?',b'_india Dear the issue is resolved Please retry.'
